{"published_at":"2026-10-21T12:54:01Z","window_months":24,"rebase":"2018-01=100","months":["2024-11","2024-12","2025-01","2025-02","2025-03","2025-04","2025-05","2025-06","2025-07","2025-08","2025-09","2025-10","2025-11","2025-12","2026-01","2026-02","2026-03","2026-04","2026-05","2026-06","2026-07","2026-08","2026-09","2026-10"],"components":[{"code":"shelter_owned","label":"Shelter (owned)","weight":0.262168,"ours_yoy_pct":[1.57,1.61,1.74,1.77,1.82,1.73,1.58,1.35,1.09,1.0,0.97,1.0,0.92,0.88,0.78,0.74,0.67,0.69,0.82,0.98,1.16,1.36,1.62,1.62],"official_yoy_pct":[4.92,4.8,4.6,4.43,4.38,4.31,4.16,4.15,4.07,3.98,3.76,3.76,3.36,3.35,3.26,3.19,3.1,3.3,3.32,3.25,3.23,3.08,3.28,3.28],"weights":[0.261613,0.26766,0.267131,0.267131,0.266396,0.266267,0.266914,0.26762,0.268254,0.269367,0.270025,0.270934,0.271854,0.272668,0.261988,0.261497,0.261767,0.261664,0.261798,0.261677,0.261998,0.262314,0.262168,0.262168]},{"code":"other","label":"Everything else (CPI residual)","weight":0.180519,"ours_yoy_pct":[3.62,3.69,3.77,3.39,2.07,2.21,2.55,2.87,2.95,3.18,3.2,3.2,2.67,2.81,2.77,3.05,4.21,4.71,4.55,3.91,3.36,3.21,3.45,3.45],"official_yoy_pct":[3.62,3.69,3.77,3.39,2.07,2.21,2.55,2.87,2.95,3.18,3.2,3.2,2.67,2.81,2.77,3.05,4.21,4.71,4.55,3.91,3.36,3.21,3.45,3.45],"weights":[0.18275,0.182805,0.183541,0.183541,0.184652,0.18472,0.184577,0.184363,0.184082,0.18382,0.183926,0.184077,0.184188,0.183446,0.180428,0.180798,0.180339,0.180795,0.18118,0.180968,0.180782,0.180556,0.180519,0.180519]},{"code":"food_home","label":"Food at home","weight":0.080095,"ours_yoy_pct":[1.57,1.77,1.93,1.9,2.42,2.01,2.23,2.38,2.16,2.68,2.69,2.69,1.94,2.36,2.09,2.45,1.9,2.89,2.74,2.75,2.68,2.19,1.81,1.81],"official_yoy_pct":[1.57,1.77,1.93,1.9,2.42,2.01,2.23,2.38,2.16,2.68,2.69,2.69,1.94,2.36,2.09,2.45,1.9,2.89,2.74,2.75,2.68,2.19,1.81,1.81],"weights":[0.085555,0.081772,0.081384,0.081384,0.08085,0.080611,0.08047,0.080462,0.080603,0.080474,0.080703,0.080723,0.080707,0.080786,0.080569,0.080303,0.080517,0.080017,0.080017,0.079882,0.079821,0.079934,0.080095,0.080095]},{"code":"medical","label":"Medical care","weight":0.082601,"ours_yoy_pct":[3.08,2.84,2.64,2.89,2.64,2.74,2.48,2.77,3.51,3.45,3.28,3.28,2.89,3.15,3.19,3.36,3.05,2.54,2.59,2.03,1.7,1.56,1.5,1.5],"official_yoy_pct":[3.08,2.84,2.64,2.89,2.64,2.74,2.48,2.77,3.51,3.45,3.28,3.28,2.89,3.15,3.19,3.36,3.05,2.54,2.59,2.03,1.7,1.56,1.5,1.5],"weights":[0.078804,0.080143,0.079653,0.079653,0.079525,0.079453,0.079694,0.079816,0.079545,0.079532,0.079666,0.0798,0.07997,0.080001,0.082583,0.082422,0.082441,0.082507,0.082515,0.082622,0.082907,0.082672,0.082601,0.082601]},{"code":"shelter_rent","label":"Rent","weight":0.074579,"ours_yoy_pct":[1.57,1.61,1.74,1.77,1.82,1.73,1.58,1.35,1.09,1.0,0.97,1.0,0.92,0.88,0.78,0.74,0.67,0.69,0.82,0.98,1.16,1.36,1.62,1.62],"official_yoy_pct":[4.36,4.27,4.24,4.09,3.99,3.98,3.81,3.77,3.55,3.5,3.4,3.4,2.96,2.92,2.84,2.68,2.56,2.79,2.92,2.84,2.86,2.75,2.78,2.78],"weights":[0.077552,0.076557,0.076395,0.076395,0.076184,0.076102,0.076229,0.076394,0.076626,0.076863,0.077031,0.077225,0.077498,0.077743,0.074738,0.074598,0.074637,0.074605,0.074577,0.074477,0.074518,0.074559,0.074579,0.074579]},{"code":"food_away","label":"Food away from home","weight":0.056464,"ours_yoy_pct":[3.65,3.62,3.38,3.68,3.79,3.89,3.85,3.83,3.91,3.93,3.73,3.73,3.66,4.07,3.98,3.9,3.78,3.55,3.54,3.37,3.4,3.37,3.46,3.46],"official_yoy_pct":[3.65,3.62,3.38,3.68,3.79,3.89,3.85,3.83,3.91,3.93,3.73,3.73,3.66,4.07,3.98,3.9,3.78,3.55,3.54,3.37,3.4,3.37,3.46,3.46],"weights":[0.048908,0.053838,0.053558,0.053558,0.053353,0.053331,0.053429,0.053632,0.053681,0.053778,0.053874,0.053939,0.05412,0.054262,0.056246,0.056215,0.056293,0.056366,0.056425,0.056458,0.056528,0.056528,0.056464,0.056464]},{"code":"education_comm","label":"Education & comm","weight":0.056387,"ours_yoy_pct":[0.72,0.61,0.49,0.33,0.55,0.22,0.3,0.47,0.35,0.35,0.39,0.39,1.47,0.48,0.55,0.06,0.03,0.16,0.84,-0.06,0.55,2.14,2.31,2.31],"official_yoy_pct":[0.72,0.61,0.49,0.33,0.55,0.22,0.3,0.47,0.35,0.35,0.39,0.39,1.47,0.48,0.55,0.06,0.03,0.16,0.84,-0.06,0.55,2.14,2.31,2.31],"weights":[0.056509,0.058969,0.058846,0.058846,0.058411,0.058271,0.058141,0.0581,0.058147,0.05828,0.0583,0.058043,0.057813,0.057755,0.057098,0.056988,0.056927,0.056647,0.056545,0.056429,0.056384,0.056397,0.056387,0.056387]},{"code":"recreation","label":"Recreation","weight":0.052717,"ours_yoy_pct":[1.5,1.12,1.64,1.78,1.85,1.6,1.82,2.06,2.39,2.3,3.03,3.03,1.79,3.01,2.55,2.27,2.24,2.34,2.62,2.83,2.58,2.68,2.84,2.84],"official_yoy_pct":[1.5,1.12,1.64,1.78,1.85,1.6,1.82,2.06,2.39,2.3,3.03,3.03,1.79,3.01,2.55,2.27,2.24,2.34,2.62,2.83,2.58,2.68,2.84,2.84],"weights":[0.053527,0.053164,0.053037,0.053037,0.052644,0.052526,0.052328,0.052309,0.05231,0.052243,0.051947,0.052064,0.052176,0.052158,0.053228,0.053268,0.053131,0.052923,0.052814,0.052759,0.052913,0.05269,0.052717,0.052717]},{"code":"new_vehicles","label":"New vehicles","weight":0.042979,"ours_yoy_pct":[-0.69,-0.4,-0.33,-0.31,-0.04,0.31,0.43,0.25,0.41,0.66,0.75,0.88,0.62,0.27,0.37,0.45,0.47,0.23,0.24,0.5,0.54,0.57,0.61,0.61],"official_yoy_pct":[-0.69,-0.4,-0.33,-0.31,-0.04,0.31,0.43,0.25,0.41,0.66,0.75,0.88,0.62,0.27,0.37,0.45,0.47,0.23,0.24,0.5,0.54,0.57,0.61,0.61],"weights":[0.042158,0.036707,0.036481,0.036481,0.036177,0.036037,0.035918,0.035915,0.035841,0.03575,0.035673,0.035577,0.035658,0.035662,0.043756,0.04357,0.043504,0.043522,0.043415,0.043198,0.043164,0.043071,0.042979,0.042979]},{"code":"fuel","label":"Gasoline","weight":0.029754,"ours_yoy_pct":[-7.45,-3.53,1.34,-4.41,-10.25,-14.59,-11.83,-7.97,-10.03,-6.95,-2.1,-3.47,0.49,-7.04,-8.23,-6.7,28.09,31.26,41.03,19.23,29.73,27.95,40.73,39.67],"official_yoy_pct":[-8.07,-3.43,-0.17,-3.09,-9.77,-11.76,-11.95,-8.29,-9.46,-6.63,-0.52,-1.68,0.94,-3.4,-7.49,-5.62,18.92,28.42,40.46,26.72,24.64,27.4,34.17,34.17],"weights":[0.030104,0.031937,0.033114,0.033114,0.035023,0.0367,0.036474,0.035041,0.035277,0.034285,0.032496,0.031853,0.030946,0.030607,0.029349,0.029594,0.029263,0.030012,0.029749,0.029679,0.029485,0.029491,0.029754,0.029754]},{"code":"electricity","label":"Electricity","weight":0.024428,"ours_yoy_pct":[3.09,2.8,1.88,2.46,2.79,3.61,4.49,5.82,5.54,6.19,5.08,5.08,6.94,6.66,6.33,4.8,4.56,6.09,5.92,4.03,4.2,3.79,4.37,4.37],"official_yoy_pct":[3.09,2.8,1.88,2.46,2.79,3.61,4.49,5.82,5.54,6.19,5.08,5.08,6.94,6.66,6.33,4.8,4.56,6.09,5.92,4.03,4.2,3.79,4.37,4.37],"weights":[0.025399,0.024824,0.024643,0.024643,0.024649,0.024414,0.024455,0.024946,0.024931,0.024728,0.024793,0.024585,0.024188,0.024259,0.023714,0.023719,0.023898,0.02388,0.024113,0.024833,0.024744,0.024642,0.024428,0.024428]},{"code":"apparel","label":"Apparel","weight":0.025625,"ours_yoy_pct":[1.13,1.24,0.4,0.6,0.33,-0.72,-0.91,-0.52,-0.21,0.23,-0.08,-0.08,0.17,0.6,1.73,2.53,3.36,4.17,4.79,3.88,3.86,3.61,3.41,3.41],"official_yoy_pct":[1.13,1.24,0.4,0.6,0.33,-0.72,-0.91,-0.52,-0.21,0.23,-0.08,-0.08,0.17,0.6,1.73,2.53,3.36,4.17,4.79,3.88,3.86,3.61,3.41,3.41],"weights":[0.024218,0.025411,0.026052,0.026052,0.026209,0.026081,0.025829,0.025643,0.025213,0.025624,0.026331,0.025843,0.025151,0.024718,0.024853,0.025574,0.025768,0.025393,0.025088,0.02493,0.024578,0.025038,0.025625,0.025625]},{"code":"used_vehicles","label":"Used cars & trucks","weight":0.02411,"ours_yoy_pct":[-3.39,-3.25,1.03,0.75,0.58,1.52,1.8,2.79,4.79,6.04,5.08,4.6,3.56,1.63,3.56,3.56,5.54,5.54,2.92,2.92,-0.48,-1.74,-1.74,-1.79],"official_yoy_pct":[-3.39,-3.25,1.03,0.75,0.58,1.52,1.8,2.79,4.79,6.04,5.08,4.6,3.56,1.63,-1.96,-3.2,-3.18,-2.69,-1.99,-1.77,-1.87,-2.32,-1.46,-1.46],"weights":[0.025476,0.019262,0.019207,0.019207,0.019178,0.019023,0.01908,0.01914,0.018905,0.018744,0.018701,0.01875,0.018888,0.018919,0.023879,0.023786,0.023808,0.023855,0.023983,0.024219,0.024378,0.024409,0.02411,0.02411]},{"code":"nat_gas","label":"Piped gas","weight":0.007574,"ours_yoy_pct":[1.81,4.92,4.95,6.0,9.37,15.68,15.29,14.18,13.8,13.82,11.7,11.7,9.13,10.81,9.83,10.89,6.44,3.05,3.01,3.03,4.32,4.39,4.97,4.97],"official_yoy_pct":[1.81,4.92,4.95,6.0,9.37,15.68,15.29,14.18,13.8,13.82,11.7,11.7,9.13,10.81,9.83,10.89,6.44,3.05,3.01,3.03,4.32,4.39,4.97,4.97],"weights":[0.007427,0.006951,0.006958,0.006958,0.006749,0.006464,0.006462,0.006619,0.006585,0.006512,0.006534,0.006587,0.006843,0.007016,0.007571,0.007668,0.007707,0.007814,0.007781,0.007869,0.0078,0.007699,0.007574,0.007574]}]}
